{
  "room": {
    "kind": "shoebox",
    "shoebox": {
      "width": 6,
      "depth": 4.5,
      "height": 2.8,
      "wallMaterials": [
        "absorptive",
        "absorptive",
        "absorptive",
        "absorptive",
        "absorptive",
        "absorptive"
      ]
    }
  },
  "materials": {
    "absorptive": {
      "name": "absorptive",
      "absorptionByBand": [0.85, 0.85, 0.88, 0.9, 0.9, 0.92],
      "scatteringByBand": [0.05, 0.05, 0.05, 0.05, 0.05, 0.05]
    }
  },
  "sources": [
    {
      "position": { "X": 1.5, "Y": 2, "Z": 1.2 },
      "orientation": { "W": 1, "X": 0, "Y": 0, "Z": 0 },
      "gainDb": 0,
      "directivity": { "type": "omni" }
    }
  ],
  "receivers": [
    {
      "position": { "X": 4, "Y": 2, "Z": 1.2 },
      "orientation": { "W": 1, "X": 0, "Y": 0, "Z": 0 },
      "type": "binaural",
      "hrtf": { "type": "nearestNeighbor", "sampleRate": 48000 }
    }
  ],
  "bandSpec": {
    "CenterFreqs": [125, 250, 500, 1000, 2000, 4000],
    "LowerEdges": [
      88.38834764831843, 176.7766952966369, 353.5533905932738,
      707.1067811865476, 1414.213562373095, 2828.42712474619
    ],
    "UpperEdges": [
      176.7766952966369, 353.5533905932738, 707.1067811865476,
      1414.213562373095, 2828.42712474619, 5656.85424949238
    ]
  },
  "sampleRate": 48000
}
