{
  "rooms": [
    {
      "kind": "shoebox",
      "shoebox": {
        "width": 6,
        "depth": 4,
        "height": 3,
        "wallMaterials": ["wall", "wall", "wall", "wall", "wall", "wall"]
      }
    },
    {
      "kind": "shoebox",
      "shoebox": {
        "origin": { "X": 6, "Y": 0, "Z": 0 },
        "width": 6,
        "depth": 4,
        "height": 3,
        "wallMaterials": ["wall", "wall", "wall", "wall", "wall", "wall"]
      }
    }
  ],
  "portals": [
    {
      "roomIndices": [0, 1],
      "polygon": [
        { "X": 6, "Y": 1.4, "Z": 0 },
        { "X": 6, "Y": 2.6, "Z": 0 },
        { "X": 6, "Y": 2.6, "Z": 2.1 },
        { "X": 6, "Y": 1.4, "Z": 2.1 }
      ],
      "material": "door",
      "state": "closed"
    }
  ],
  "materials": {
    "wall": {
      "name": "wall",
      "absorptionByBand": [0.08, 0.09, 0.12, 0.15, 0.12, 0.1],
      "scatteringByBand": [0.04, 0.05, 0.06, 0.08, 0.1, 0.12]
    },
    "door": {
      "name": "door",
      "absorptionByBand": [0.08],
      "scatteringByBand": [0.06],
      "soundReductionIndex": [25]
    }
  },
  "sources": [
    {
      "position": { "X": 2, "Y": 2, "Z": 1.2 },
      "orientation": { "W": 1, "X": 0, "Y": 0, "Z": 0 },
      "gainDb": 0,
      "directivity": { "type": "omni" }
    }
  ],
  "receivers": [
    {
      "position": { "X": 9, "Y": 2, "Z": 1.2 },
      "orientation": { "W": 1, "X": 0, "Y": 0, "Z": 0 },
      "type": "omni"
    }
  ],
  "bandSpec": {
    "CenterFreqs": [125, 250, 500, 1000, 2000, 4000],
    "LowerEdges": [
      88.38834764831843, 176.7766952966369, 353.5533905932738,
      707.1067811865476, 1414.213562373095, 2828.42712474619
    ],
    "UpperEdges": [
      176.7766952966369, 353.5533905932738, 707.1067811865476,
      1414.213562373095, 2828.42712474619, 5656.85424949238
    ]
  },
  "sampleRate": 48000
}
