{
  "room": {
    "kind": "mesh",
    "meshPath": "../rooms/cube.obj"
  },
  "materials": {
    "concrete": {
      "name": "concrete",
      "absorptionByBand": [0.04, 0.04, 0.05, 0.06, 0.07, 0.08],
      "scatteringByBand": [0.01, 0.01, 0.02, 0.02, 0.03, 0.03]
    },
    "glass": {
      "name": "glass",
      "absorptionByBand": [0.02, 0.02, 0.03, 0.03, 0.04, 0.04],
      "scatteringByBand": [0.01, 0.01, 0.01, 0.02, 0.02, 0.02]
    }
  },
  "sources": [
    {
      "position": { "X": 1.1, "Y": 1.5, "Z": 1.3 },
      "orientation": { "W": 1, "X": 0, "Y": 0, "Z": 0 },
      "gainDb": -2,
      "directivity": {
        "type": "cardioid",
        "axis": { "X": 1, "Y": 0, "Z": 0 },
        "orderN": 1
      }
    }
  ],
  "receivers": [
    {
      "position": { "X": 3.2, "Y": 2.7, "Z": 1.4 },
      "orientation": { "W": 1, "X": 0, "Y": 0, "Z": 0 },
      "type": "omni"
    }
  ],
  "bandSpec": {
    "CenterFreqs": [125, 250, 500, 1000, 2000, 4000],
    "LowerEdges": [88.38834764831843, 176.7766952966369, 353.5533905932738, 707.1067811865476, 1414.213562373095, 2828.42712474619],
    "UpperEdges": [176.7766952966369, 353.5533905932738, 707.1067811865476, 1414.213562373095, 2828.42712474619, 5656.85424949238]
  },
  "sampleRate": 48000
}
