{
  "rooms": [
    {
      "kind": "shoebox",
      "shoebox": {
        "width": 4,
        "depth": 4,
        "height": 3,
        "wallMaterials": ["wall", "wall", "wall", "wall", "floor", "ceiling"]
      }
    },
    {
      "kind": "shoebox",
      "shoebox": {
        "origin": { "X": 4, "Y": 0, "Z": 0 },
        "width": 4,
        "depth": 4,
        "height": 3,
        "wallMaterials": ["wall", "wall", "wall", "wall", "floor", "ceiling"]
      }
    },
    {
      "kind": "shoebox",
      "shoebox": {
        "origin": { "X": 8, "Y": 0, "Z": 0 },
        "width": 4,
        "depth": 4,
        "height": 3,
        "wallMaterials": ["wall", "wall", "wall", "wall", "floor", "ceiling"]
      }
    },
    {
      "kind": "shoebox",
      "shoebox": {
        "origin": { "X": 12, "Y": 0, "Z": 0 },
        "width": 4,
        "depth": 4,
        "height": 3,
        "wallMaterials": ["wall", "wall", "wall", "wall", "floor", "ceiling"]
      }
    }
  ],
  "portals": [
    {
      "roomIndices": [0, 1],
      "polygon": [
        { "X": 4, "Y": 1.4, "Z": 0 },
        { "X": 4, "Y": 2.6, "Z": 0 },
        { "X": 4, "Y": 2.6, "Z": 2.1 },
        { "X": 4, "Y": 1.4, "Z": 2.1 }
      ],
      "material": "partition",
      "state": "closed"
    },
    {
      "roomIndices": [1, 2],
      "polygon": [
        { "X": 8, "Y": 1.4, "Z": 0 },
        { "X": 8, "Y": 2.6, "Z": 0 },
        { "X": 8, "Y": 2.6, "Z": 2.1 },
        { "X": 8, "Y": 1.4, "Z": 2.1 }
      ],
      "material": "partition",
      "state": "closed"
    },
    {
      "roomIndices": [2, 3],
      "polygon": [
        { "X": 12, "Y": 1.4, "Z": 0 },
        { "X": 12, "Y": 2.6, "Z": 0 },
        { "X": 12, "Y": 2.6, "Z": 2.1 },
        { "X": 12, "Y": 1.4, "Z": 2.1 }
      ],
      "material": "partition",
      "state": "closed"
    }
  ],
  "materials": {
    "wall": {
      "name": "wall",
      "absorptionByBand": [0.08, 0.09, 0.12, 0.15, 0.12, 0.1],
      "scatteringByBand": [0.04, 0.05, 0.06, 0.08, 0.1, 0.12]
    },
    "floor": {
      "name": "floor",
      "absorptionByBand": [0.04, 0.04, 0.05, 0.06, 0.06, 0.07],
      "scatteringByBand": [0.03, 0.04, 0.05, 0.06, 0.08, 0.1]
    },
    "ceiling": {
      "name": "ceiling",
      "absorptionByBand": [0.2, 0.25, 0.35, 0.4, 0.45, 0.5],
      "scatteringByBand": [0.05, 0.06, 0.07, 0.08, 0.1, 0.12]
    },
    "partition": {
      "name": "partition",
      "absorptionByBand": [0.08],
      "scatteringByBand": [0.06],
      "soundReductionIndex": [20]
    }
  },
  "sources": [
    {
      "position": { "X": 2, "Y": 2, "Z": 1.5 },
      "orientation": { "W": 1, "X": 0, "Y": 0, "Z": 0 },
      "gainDb": 0,
      "directivity": { "type": "omni" }
    }
  ],
  "receivers": [
    {
      "position": { "X": 6, "Y": 2, "Z": 1.5 },
      "orientation": { "W": 1, "X": 0, "Y": 0, "Z": 0 },
      "type": "omni"
    }
  ],
  "bandSpec": {
    "CenterFreqs": [125, 250, 500, 1000, 2000, 4000],
    "LowerEdges": [88.4, 176.8, 353.6, 707.1, 1414.2, 2828.4],
    "UpperEdges": [176.8, 353.6, 707.1, 1414.2, 2828.4, 5656.9]
  },
  "sampleRate": 48000
}
