{
  "room": {
    "kind": "shoebox",
    "shoebox": {
      "width": 12,
      "depth": 8,
      "height": 4,
      "wallMaterials": [
        "lecture",
        "lecture",
        "lecture",
        "lecture",
        "lecture",
        "lecture"
      ]
    }
  },
  "materials": {
    "lecture": {
      "name": "lecture",
      "absorptionByBand": [0.08, 0.1, 0.12, 0.14, 0.16, 0.18],
      "scatteringByBand": [0.03, 0.03, 0.03, 0.04, 0.04, 0.05]
    }
  },
  "sources": [
    {
      "position": { "X": 2, "Y": 2.4, "Z": 1.2 },
      "orientation": { "W": 1, "X": 0, "Y": 0, "Z": 0 },
      "gainDb": 0,
      "directivity": { "type": "omni" }
    }
  ],
  "receivers": [
    {
      "position": { "X": 8.5, "Y": 5.4, "Z": 2.8 },
      "orientation": { "W": 1, "X": 0, "Y": 0, "Z": 0 },
      "type": "omni"
    }
  ],
  "bandSpec": {
    "CenterFreqs": [125, 250, 500, 1000, 2000, 4000],
    "LowerEdges": [
      88.38834764831843, 176.7766952966369, 353.5533905932738,
      707.1067811865476, 1414.213562373095, 2828.42712474619
    ],
    "UpperEdges": [
      176.7766952966369, 353.5533905932738, 707.1067811865476,
      1414.213562373095, 2828.42712474619, 5656.85424949238
    ]
  },
  "sampleRate": 48000
}
