{
  "room": {
    "kind": "shoebox",
    "shoebox": {
      "width": 10,
      "depth": 6,
      "height": 3,
      "wallMaterials": ["pa", "pa", "pa", "pa", "pa", "pa"]
    }
  },
  "materials": {
    "pa": {
      "name": "pa",
      "absorptionByBand": [0.12, 0.14, 0.16, 0.18, 0.2, 0.22],
      "scatteringByBand": [0.03, 0.03, 0.03, 0.03, 0.04, 0.04]
    }
  },
  "sources": [
    {
      "position": { "X": 2, "Y": 3, "Z": 1.5 },
      "orientation": { "W": 1, "X": 0, "Y": 0, "Z": 0 },
      "gainDb": 0,
      "directivity": {
        "type": "cardioid",
        "axis": { "X": 1, "Y": 0, "Z": 0 },
        "orderN": 1
      }
    }
  ],
  "receivers": [
    {
      "position": { "X": 8, "Y": 3, "Z": 1.5 },
      "orientation": { "W": 1, "X": 0, "Y": 0, "Z": 0 },
      "type": "omni"
    }
  ],
  "bandSpec": {
    "CenterFreqs": [125, 250, 500, 1000, 2000, 4000],
    "LowerEdges": [
      88.38834764831843, 176.7766952966369, 353.5533905932738,
      707.1067811865476, 1414.213562373095, 2828.42712474619
    ],
    "UpperEdges": [
      176.7766952966369, 353.5533905932738, 707.1067811865476,
      1414.213562373095, 2828.42712474619, 5656.85424949238
    ]
  },
  "sampleRate": 48000
}
