{
  "room": {
    "kind": "shoebox",
    "shoebox": {
      "width": 2,
      "depth": 1.5,
      "height": 1.2,
      "wallMaterials": ["tight", "tight", "tight", "tight", "tight", "tight"]
    }
  },
  "materials": {
    "tight": {
      "name": "tight",
      "absorptionByBand": [0.35, 0.35, 0.4, 0.45, 0.5, 0.55],
      "scatteringByBand": [0.02, 0.02, 0.02, 0.03, 0.03, 0.04]
    }
  },
  "sources": [
    {
      "position": { "X": 0.45, "Y": 0.35, "Z": 0.25 },
      "orientation": { "W": 1, "X": 0, "Y": 0, "Z": 0 },
      "gainDb": 0,
      "directivity": { "type": "omni" }
    }
  ],
  "receivers": [
    {
      "position": { "X": 1.55, "Y": 1.1, "Z": 0.85 },
      "orientation": { "W": 1, "X": 0, "Y": 0, "Z": 0 },
      "type": "omni"
    }
  ],
  "bandSpec": {
    "CenterFreqs": [125, 250, 500, 1000, 2000, 4000],
    "LowerEdges": [
      88.38834764831843, 176.7766952966369, 353.5533905932738,
      707.1067811865476, 1414.213562373095, 2828.42712474619
    ],
    "UpperEdges": [
      176.7766952966369, 353.5533905932738, 707.1067811865476,
      1414.213562373095, 2828.42712474619, 5656.85424949238
    ]
  },
  "sampleRate": 48000
}
